{
  "base_report": "atl-345035d528ae68c9",
  "changed_dimensions": [
    {
      "after": {
        "status": "observed",
        "value": true
      },
      "before": {
        "status": "observed_absent",
        "value": false
      },
      "dimension": "root_presence",
      "evidence_paths": [
        "root_state.su_present"
      ],
      "interpretation": "Root-related evidence changed between reports. This is an observation, not an app verdict or bypass claim.",
      "severity": "medium"
    }
  ],
  "compare_report": "atl-40b3dd9d667c204d",
  "confidence_changes": [],
  "diff_id": "atldiff-4dac712d13ad4000",
  "missing_signals": [],
  "new_signals": [],
  "provenance": {
    "base": {
      "applied_migrations": [],
      "common_report_id": "atl-345035d528ae68c9",
      "original_report_id": "atl-345035d528ae68c9",
      "original_schema_version": "2.0.0"
    },
    "common_report_schema_version": "2.0.0",
    "compare": {
      "applied_migrations": [],
      "common_report_id": "atl-40b3dd9d667c204d",
      "original_report_id": "atl-40b3dd9d667c204d",
      "original_schema_version": "2.0.0"
    }
  },
  "schema_version": "1.0.0",
  "summary": "1 dimensions changed, 10 dimensions unchanged.",
  "unchanged_dimensions": [
    "bootloader_lock_state",
    "verified_boot_state",
    "vbmeta_state",
    "verity_mode",
    "selinux_mode",
    "mount_integrity",
    "magisk_presence",
    "property_consistency",
    "emulator_state",
    "observer_privilege"
  ]
}
